{
  "id": "01jrcasebox0000000000000d2",
  "tenant_id": "tenant-local-v1",
  "actor_user_id": "local-user",
  "matter_id": "01jrcasebox0000000000000m1",
  "source_type": "court_order_excerpt",
  "proposed_kind": "court_order",
  "proposed_due_at": "2026-06-15T17:00:00.000Z",
  "proposed_due_at_kind": "datetime",
  "proposed_due_at_timezone": "Asia/Shanghai",
  "proposed_owner_user_id": "local-user",
  "source_rule_citation": "Court order dated 2026-05-15, paragraph 3",
  "extractor_name": null,
  "extractor_version": null,
  "extraction_confidence": null,
  "source_document_id": "01jrcasebox0000000000000c0",
  "source_page_number": 2,
  "source_excerpt": "All defendants shall file their answers no later than 17:00 on June 15, 2026.",
  "reminder_offsets": null,
  "confirmation_state": "proposed",
  "proposed_at": "2026-05-20T16:05:00.000Z",
  "confirmation_actor_user_id": null,
  "confirmed_at": null,
  "confirmed_deadline_id": null,
  "dismissal_actor_user_id": null,
  "dismissed_at": null,
  "dismissal_reason": null,
  "created_at": "2026-05-20T16:05:00.000Z"
}
