{
  "id": "01jrcasebox0000000000000d1",
  "tenant_id": "tenant-local-v1",
  "actor_user_id": "local-user",
  "matter_id": "01jrcasebox0000000000000m1",
  "source_type": "llm_extraction",
  "proposed_kind": "filing",
  "proposed_due_at": "2026-06-15T00:00:00.000Z",
  "proposed_due_at_kind": "date_only",
  "proposed_due_at_timezone": null,
  "proposed_owner_user_id": "local-user",
  "source_rule_citation": "FRCP 12(a)(1)(A)",
  "extractor_name": "claude-opus-4-7",
  "extractor_version": "2026-05-01",
  "extraction_confidence": 0.78,
  "source_document_id": null,
  "source_page_number": null,
  "source_excerpt": null,
  "reminder_offsets": null,
  "confirmation_state": "proposed",
  "proposed_at": "2026-05-20T16:00:00.000Z",
  "confirmation_actor_user_id": null,
  "confirmed_at": null,
  "confirmed_deadline_id": null,
  "dismissal_actor_user_id": null,
  "dismissed_at": null,
  "dismissal_reason": null,
  "created_at": "2026-05-20T16:00:00.000Z"
}
