{
  "id": "01jrcasebox0000000000000k2",
  "tenant_id": "tenant-local-v1",
  "actor_user_id": "local-user",
  "matter_id": "01jrcasebox0000000000000m1",
  "source_type": "manual",
  "proposed_kind": "evidence_submission",
  "proposed_due_at": "2026-07-10T17:00:00.000Z",
  "proposed_due_at_kind": "datetime",
  "proposed_due_at_timezone": "Asia/Shanghai",
  "proposed_owner_user_id": "local-user",
  "source_rule_citation": "Court order 2026-沪01民初123号 — evidence submission window",
  "extractor_name": null,
  "extractor_version": null,
  "extraction_confidence": null,
  "source_document_id": null,
  "source_page_number": null,
  "source_excerpt": null,
  "reminder_offsets": null,
  "confirmation_state": "proposed",
  "proposed_at": "2026-05-22T16:05:00.000Z",
  "confirmation_actor_user_id": null,
  "confirmed_at": null,
  "confirmed_deadline_id": null,
  "dismissal_actor_user_id": null,
  "dismissed_at": null,
  "dismissal_reason": null,
  "created_at": "2026-05-22T16:05:00.000Z"
}
