{
  "id": "01jrcasebox0000000000000d4",
  "tenant_id": "tenant-local-v1",
  "actor_user_id": "local-user",
  "matter_id": "01jrcasebox0000000000000m1",
  "source_type": "imported",
  "proposed_kind": "filing",
  "proposed_due_at": "2026-07-01T00:00:00.000Z",
  "proposed_due_at_kind": "date_only",
  "proposed_due_at_timezone": null,
  "proposed_owner_user_id": "local-user",
  "source_rule_citation": null,
  "extractor_name": "clio-import-v1",
  "extractor_version": "2026-04-30",
  "extraction_confidence": null,
  "source_document_id": null,
  "source_page_number": null,
  "source_excerpt": null,
  "reminder_offsets": null,
  "confirmation_state": "proposed",
  "proposed_at": "2026-05-20T16:15:00.000Z",
  "confirmation_actor_user_id": null,
  "confirmed_at": null,
  "confirmed_deadline_id": null,
  "dismissal_actor_user_id": null,
  "dismissed_at": null,
  "dismissal_reason": null,
  "created_at": "2026-05-20T16:15:00.000Z"
}
