{
  "id": "01jrcasebox0000000000000d6",
  "tenant_id": "tenant-local-v1",
  "actor_user_id": "local-user",
  "matter_id": "01jrcasebox0000000000000m1",
  "source_type": "llm_extraction",
  "proposed_kind": "discovery",
  "proposed_due_at": "2026-08-01T00:00:00.000Z",
  "proposed_due_at_kind": "date_only",
  "proposed_due_at_timezone": null,
  "proposed_owner_user_id": "local-user",
  "source_rule_citation": null,
  "extractor_name": "claude-opus-4-7",
  "extractor_version": "2026-05-01",
  "extraction_confidence": 0.42,
  "source_document_id": null,
  "source_page_number": null,
  "source_excerpt": null,
  "reminder_offsets": null,
  "confirmation_state": "dismissed",
  "proposed_at": "2026-05-20T16:25:00.000Z",
  "confirmation_actor_user_id": null,
  "confirmed_at": null,
  "confirmed_deadline_id": null,
  "dismissal_actor_user_id": "local-user",
  "dismissed_at": "2026-05-20T16:30:00.000Z",
  "dismissal_reason": "LLM hallucinated; no court order references this date.",
  "created_at": "2026-05-20T16:25:00.000Z"
}
